[
  {
    "id": "rknsi7sy",
    "severity": "panic",
    "product": "iphone",
    "title": "11 - Reset Counter",
    "desc": "watchdog timeout",
    "devices": [
      "iphone11"
    ],
    "tags": [
      "reset counter"
    ],
    "logSample": "panic(cpu 2 caller 0xfffffff01da72818): <span style='color:#ff3838'>userspace watchdog timeout: no successful checkins from logd in 180 seconds</span><br><span style='background-color:cyan; color:black'><b>service returned not alive with context: unresponsive dispatch queue(s): com.apple.firehose.io-wl<br>logd appears to not exist in launchd</b></span><br>service: backboardd, total successful checkins in 1126 seconds: 111, last successful checkin: 0 seconds ago<br>service: SpringBoard, total successful checkins in 1093 seconds: 109, last successful checkin: 0 seconds ago<br>service: mediaserverd, total successful checkins in 1126 seconds: 110, last successful checkin: 0 seconds ago<br>service: logd, total successful checkins in 1126 seconds: 93, last successful checkin: 180 seconds ago<br>service: thermalmonitord, total successful checkins in 1126 seconds: 92, last successful checkin: 180 seconds ago<br>service: runningboardd, total successful checkins in 1126 seconds: 111, last successful checkin: 0 seconds ago<br>service: wifid, total successful checkins in 1126 seconds: 93, last successful checkin: 180 seconds ago<br>service: configd, total successful checkins in 1126 seconds: 110, last successful checkin: 0 seconds ago<br>Debugger message: panic<br>Memory ID: 0x1<br>OS release type: User<br>OS version: 20F75<br>Kernel version: Darwin Kernel Version 22.5.0...",
    "fixType": "software",
    "fixes": [
      {
        "title": "Chạy chương trình, xóa toàn bộ dữ liệu",
        "desc": "",
        "code": "Có thể sao lưu ảnh, danh bạ trước khi chạy. Không sao lưu cài đặt, ứng dụng"
      }
    ],
    "images": [
      "iPhone/11/panic/wd_timeout_001.png"
    ],
    "imageOnly": false,
    "fixesOnly": false
  },
  {
    "id": "lhd1znb6",
    "severity": "diagram",
    "product": "iphone",
    "title": "14 PM - Cáp sạc",
    "desc": "Hình ảnh cụm tail dock của iPhone 14 Pro Max.",
    "devices": [
      "iphone14promax"
    ],
    "tags": [
      "Cáp sạc",
      "taildock"
    ],
    "logSample": "",
    "fixType": "hardware",
    "fixes": [],
    "images": [
      "iPhone/14PM/taildock.png"
    ],
    "imageOnly": true,
    "fixesOnly": false
  },
  {
    "id": "lutxc9aj",
    "severity": "diagram",
    "product": "iphone",
    "title": "13 Pro Max - Cáp sạc",
    "desc": "Sơ đồ cáp sạc 13 Pro Max",
    "devices": [
      "iphone13promax"
    ],
    "tags": [
      "Cáp sạc"
    ],
    "logSample": "",
    "fixType": "hardware",
    "fixes": [],
    "images": [
      "iPhone/13PM/taildock.png"
    ],
    "imageOnly": true,
    "fixesOnly": false
  },
  {
    "id": "972oy5yy",
    "severity": "diagram",
    "product": "iphone",
    "title": "12 Pro Max - Cáp sạc",
    "desc": "Ảnh tham chiếu tail dock cho iPhone 12 Pro Max.",
    "devices": [
      "iphone12promax"
    ],
    "tags": [
      "Cáp sạc"
    ],
    "fixType": "hardware",
    "fixes": [],
    "images": [
      "iPhone/12PM/taildock.png"
    ],
    "imageOnly": true,
    "fixesOnly": false
  },
  {
    "id": "muykqwry",
    "severity": "diagram",
    "product": "iphone",
    "title": "iPhone 12 Pro Max Back Camera",
    "desc": "Ảnh tham chiếu cụm camera sau iPhone 12 Pro Max.",
    "devices": [
      "iphone12promax"
    ],
    "tags": [
      "back camera"
    ],
    "fixType": "hardware",
    "fixes": [],
    "images": [
      "iPhone/12PM/backcam.png"
    ],
    "imageOnly": true,
    "fixesOnly": false
  },
  {
    "id": "s0vcm9uh",
    "severity": "diagram",
    "product": "iphone",
    "title": "iPhone 13 Pro Back Camera",
    "desc": "Ảnh tham chiếu cụm camera sau iPhone 13 Pro.",
    "devices": [
      "iphone13pro"
    ],
    "tags": [
      "back camera"
    ],
    "fixType": "hardware",
    "fixes": [],
    "images": [
      "iPhone/13P/backcam.png"
    ],
    "imageOnly": true,
    "fixesOnly": false
  },
  {
    "id": "yxwma62w",
    "severity": "diagram",
    "product": "ipad",
    "title": "iPad Air 4 Tail Dock",
    "desc": "Ảnh tham chiếu tail dock cho iPad Air 4.",
    "devices": [
      "ipadair",
      "ipadair4"
    ],
    "tags": [
      "taildock",
      "Cáp sạc"
    ],
    "fixType": "hardware",
    "fixes": [],
    "images": [
      "iPad/air/air4_taildock.png"
    ],
    "imageOnly": true,
    "fixesOnly": false
  },
  {
    "id": "05z8z6ph",
    "severity": "diagram",
    "product": "ipad",
    "title": "iPad Gen 9",
    "desc": "Ảnh tham chiếu cho iPad thế hệ 9.",
    "devices": [
      "ipadgen",
      "ipadgen9"
    ],
    "tags": [],
    "fixType": "hardware",
    "fixes": [],
    "images": [
      "iPad/gen/ipad9,7.png"
    ],
    "imageOnly": true,
    "fixesOnly": false
  },
  {
    "id": "6rustgax",
    "severity": "diagram",
    "product": "watch",
    "title": "Apple Watch Series 5 44mm",
    "desc": "Bộ ảnh tham chiếu cho Apple Watch Series 5 44mm.",
    "devices": [
      "watchseries5",
      "watchseries544mm"
    ],
    "tags": [],
    "fixType": "hardware",
    "fixes": [],
    "images": [
      "watch/sr5_44/all.png"
    ],
    "imageOnly": true,
    "fixesOnly": false
  },
  {
    "id": "lp3owg3v",
    "severity": "diagram",
    "product": "iphone",
    "title": "iPhone 14 Pro Max - Camera 0.5x",
    "desc": "Sơ đồ camera 0.5 của iphone 14 pro max",
    "devices": [
      "iphone14promax"
    ],
    "tags": [
      "14promax",
      "camera"
    ],
    "fixType": "hardware",
    "fixes": [],
    "images": [
      "14pm_cam0,5.jpeg"
    ],
    "imageOnly": true,
    "fixesOnly": false
  },
  {
    "id": "6p6y43eq",
    "severity": "panic",
    "product": "iphone",
    "title": "XS Max - Reset Counter",
    "desc": "XSMax panic nút nguồn",
    "devices": [
      "xsm"
    ],
    "tags": [
      "nút nguồn",
      "power key"
    ],
    "logSample": "  \"panicString\" : \"panic(cpu 5 caller 0xfffffff0196717b8): \"i2c1::_checkBusStatus Bus is still in a bad state; last read status 00010110 int shadow 00010100 xfer 00000000 fifo 00000000 for device mic-temp-sens2\" @AppleS5L8940XI2C.cpp:503\nDebugger message: panic\nMemory ID: 0x6\nOS release type: Not set yet\nOS version: Not set yet\nKernel version: Darwin Kernel Version 24.6.0: Wed Mar  4 22:11:45 PST 2026; root:xnu-11417.140.69.706.9~1\\/RELEASE_ARM64_T8020\nFileset Kernelcache UUID: 137FF469188FE7D2F87163A0C1373AC7\nKernel UUID: F5910B7F-4DD1-3B13-BD28-F980FAD5BECE\nBoot session UUID: 72BCDEDC-4D39-4B7D-8E0E-56CB21CF6934\niBoot version: iBoot-11881.140.96.700.1\niBoot Stage 2 version: \nsecure boot?: YES\nroots installed: 0\nPaniclog version: 14\nKernelCache slide: 0x0000000010384000\nKernelCache base:  0xfffffff017388000\nKernel slide:",
    "fixType": "hardware",
    "fixes": [],
    "images": [
      "img_1778811241340_487r7l5g41e.PNG"
    ],
    "imageOnly": false,
    "fixesOnly": false
  },
  {
    "id": "sh6n76u7",
    "severity": "panic",
    "product": "iphone",
    "title": "14 PM - Reset Counter",
    "desc": "SMC PANIC",
    "devices": [
      "iphone14promax"
    ],
    "tags": [
      "reset counter",
      "reset",
      "rs",
      "taildock",
      "cap sac",
      "cáp sạc"
    ],
    "logSample": "panic(cpu 0 caller 0xfffffff036e42c88): SMC PANIC - ASSERT: target\\/d74\\/target.cpp:321: 0, SMC BSC failure, TAOP TAOJ\nspreadsheet ver(*10) 150\nS.sensor array 0 - 5 is 0, 1310720, 0, 0, 0\nF.sensor array 0 - 1 is 0\n\n - Misc(2) OUTBOX1 not ready\nASSERT: target\\/d74\\/target.cpp:321: 0, SMC BSC failure, TAOP TAOJ\nspreadsheet ver(*10) 150\nS.sensor array 0 - 5 is 0, 1310720, 0, 0, 0\nF.sensor array 0 - 1 is 0\n\n\nRTKit: RTKit-3255.120.11.release - Client: AppleSMCFirmware_H15-6164.120.29.d74.REL\n!UUID: a3a3c2b7-af14-32a6-b8fe-bbd2960f3099\nASLR slide: 0x0000000000000000\nTime: 0x00000001123702e8\n\nFaulting task   2 Call Stack: 0x0000000000044954 0x0000000000044320 0x000000000004414c 0x0000000000042c18 0x0000000000032284 0x0000000000038a94 0x0000000000040524\n\nChinook ASC Async error info: \nl2c_err_sts 0x5000fbfc00000000, l2c_err_adr 000000000000000000, l2c_err_inf 000000000000000000\nlsu_err_sts 000000000000000000, fed_err_sts 000000000000000000, mmu_err_sts 000000000000000000\ndpc_err_sts 000000000000000000\n\nMailbox (0): (0)\n  Inbox  AKF_KIC_INBOX_CTRL = 0x00020001, AKF_KIC_MAILBOX_SET = 0x11111101",
    "fixType": "hardware",
    "fixes": [
      {
        "title": "Thay cáp sạc khác",
        "desc": "Đảm bảo vấn đề ở cáp sạc",
        "code": null
      },
      {
        "title": "Kiểm tra mic áp suất",
        "desc": "Kiểm tra mic áp suất trên cáp sạc có dấu hiệu vào nước hay rơi vỡ không",
        "code": null
      },
      {
        "title": "Kiểm tra tụ phía sau mic áp suất có bị cháy không",
        "desc": "",
        "code": null
      }
    ],
    "images": [
      "img_1779195878588_lcsgmh8jdxl.jpg",
      "img_1779195878626_7q8e9l8p1vy.jpg",
      "img_1779195878613_g165ak7cag9.PNG"
    ],
    "imageOnly": false,
    "fixesOnly": false
  }
]